{
  "title": "What Is a Semantic Layer?",
  "definition": [
    {
      "boldSentence": "A semantic layer is a governed metadata layer that translates raw data into business-meaningful terms, metrics, hierarchies, and definitions.",
      "supportingText": "It sits between raw data sources and the AI or BI tools that consume them, ensuring that calculated metrics, relationships, and business logic are applied consistently — so every downstream tool computes the same answer from the same governed source."
    },
    {
      "boldSentence": "A semantic layer standardizes key business metrics and definitions across teams, ensuring consistent reporting, trusted insights, and more confident decision-making.",
      "supportingText": "That means Finance, Marketing, and Sales calculate 'revenue' or 'active user' the same way every time — no reconciling numbers before a meeting, no conflicting dashboards."
    },
    {
      "boldSentence": "A semantic layer gives AI agents governed business context, ensuring accurate, consistent insights from enterprise data by standardizing definitions for key metrics and entities.",
      "supportingText": "Rather than guessing at business logic from raw tables, AI agents query the same governed definitions people already trust — so an AI-generated answer matches what an analyst would have produced by hand."
    }
  ],
  "sections": [
    {
      "heading": "What Is a Semantic Layer?",
      "blocks": [
        {
          "type": "paragraph",
          "text": "At its core, a semantic layer is the translation layer between how data is stored and how a business actually talks about it. Databases store rows, columns, and joins; the people and systems that consume that data think in terms of revenue, churn, active users, and quarterly hierarchies. A semantic layer sits in between and does that translation once, centrally, so every report, dashboard, and AI query draws from the same governed set of definitions instead of each tool or analyst re-deriving the logic independently."
        },
        {
          "type": "video",
          "contentstackUid": "bltfb3d9af8e01be23d",
          "caption": "Strategy Mosaic Promo (Wistia ID 4axrx3zvc9, entry ID bltfb3d9af8e01be23d, content type 'video') — sourced from Contentstack's own Entry Information panel per Ash, 2026-09-14."
        }
      ]
    },
    {
      "heading": "How Does a Semantic Layer Work?",
      "blocks": [
        {
          "type": "paragraph",
          "text": "The semantic layer sits between raw data sources and the AI and BI tools that consume them. Rather than letting every downstream tool interpret raw table structures and column names on its own, the semantic layer intercepts those queries and enforces a consistent layer of business logic before any answer is returned."
        },
        {
          "type": "image",
          "sourcePath": "how-semantic-layer-works.png",
          "assetUid": "bltf2745815ffe78a79",
          "altText": "Diagram showing how a semantic layer connects source systems (cloud data, databases, apps, files) through an analytical engine, AI-assisted data modeling, and a consumer data product catalog to downstream outputs (BI tools, AI agents, embedded analytics, data science, productivity tools).",
          "caption": "How a semantic layer works: source data flows through the analytical engine, AI-assisted data modeling, and governed data product catalog to power BI tools, AI agents, and more."
        },
        {
          "type": "paragraph",
          "text": "Think of it as a universal dictionary for your data. Each term — revenue, churn, active user — has one authoritative definition, enforced mathematically, so the number Finance sees in its report is the same number Marketing sees in its dashboard and the same number an AI agent returns when asked the question in natural language."
        },
        {
          "type": "paragraph",
          "text": "Concretely, the semantic layer provides:"
        },
        {
          "type": "list",
          "style": "bullet",
          "items": [
            "Business-meaningful names for tables, columns, and metrics — so AI knows that tbl_rev_q3 means 'Q3 Revenue,' not just a string of characters.",
            "Calculated metrics with consistent definitions, encoded once and reused across every dashboard, report, and AI interface.",
            "Row- and column-level permissions and governance, so executives get high-level rollups and analysts get appropriately filtered views.",
            "Lineage — where data came from and how it was transformed.",
            "Business hierarchies across geography, product, and time.",
            "Relationships between business entities.",
            "Full version control and audit trails — every change to a KPI, filter, or access rule is logged automatically."
          ]
        },
        {
          "type": "paragraph",
          "text": "In Strategy Mosaic, that governed layer is also queryable in natural language. Ask, 'Which customers are at risk this quarter?' and get answers based on the same logic as your executive dashboard — from Slack, Excel, Chrome, Teams, and more."
        }
      ]
    },
    {
      "heading": "What Are the Benefits of a Semantic Layer?",
      "blocks": [
        {
          "type": "paragraph",
          "text": "The semantic layer addresses one of the most persistent problems in enterprise data architecture: teams spending more time reconciling numbers than generating insights. When metrics are inconsistent across tools, AI initiatives stall and confidence in data erodes. The semantic layer resolves that at the infrastructure level."
        },
        {
          "type": "list",
          "style": "numbered",
          "items": [
            "Consistent Metrics Across Every Team — Sales, Finance, HR, Customer Success, and Marketing all pull from the same definitions, so terms like 'churn' or 'active user' never change from one meeting to the next.",
            "Faster, More Confident Decisions — real-time dashboards and AI-powered querying give teams actionable insights instantly, accessible from Slack, Excel, Chrome, Teams, and more.",
            "Governed Access and Auditability — executives get high-level rollups, analysts get filtered views, and all activity is traceable. Every change to a KPI, filter, or access rule is logged with full version control.",
            "Reusable Logic for Scalable Insights — define metrics once and reuse them across dashboards, business units, reports, and AI interfaces, eliminating the duplicated logic and compounding maintenance that occur when business rules get recreated across BI tools, data transformations, and spreadsheets.",
            "Seamless Integration Across Tools — from Salesforce to spreadsheets to custom BI dashboards, metrics stay accurate, unified, and live.",
            "AI Accuracy and Trustworthiness — AI agents operating through a semantic layer produce results that are not just computationally valid but semantically correct, because they compute on governed definitions rather than guessing at business logic from raw SQL."
          ]
        },
        {
          "type": "callout",
          "label": "Supporting data:",
          "text": "Analysts spend 38% of their time on work a semantic layer could eliminate (CIO Dive, 2026). — See validation warning: this figure requires independent verification before publishing, and Frank has asked for it to be backed by a named research source (Gartner, Forrester, IDC, or similar) with a working citation link."
        }
      ]
    },
    {
      "heading": "What Are the Core Components of a Semantic Layer?",
      "blocks": [
        {
          "type": "paragraph",
          "text": "A semantic layer isn't a single tool — it's a set of layered capabilities that work together to turn raw data into governed, business-ready meaning. The core components are:"
        },
        {
          "type": "list",
          "style": "bullet",
          "items": [
            "Business Metric & Definition Layer — the authoritative, centrally maintained definitions for metrics like revenue, churn, or active user, encoded once and reused everywhere.",
            "Data Model, Hierarchies & Relationships — how tables, entities, and time, geography, or product hierarchies relate to each other, so a query can roll up or drill down consistently.",
            "Governance & Access Control — row- and column-level permissions, so the same governed metric returns the right slice of data for an executive, an analyst, or an external partner.",
            "Calculation & Query Engine — the execution layer that computes a metric on demand and generates the query logic behind the scenes, rather than leaving that logic to whichever tool happens to be asking.",
            "Lineage & Version Control — a record of where a definition came from, who changed it, and when, so every number is auditable back to its source.",
            "Interfaces for BI, AI, and Natural Language — the connection points (APIs, MCP servers, BI connectors) that let dashboards, spreadsheets, and AI agents all query the same governed layer instead of the raw tables underneath it."
          ]
        },
        {
          "type": "paragraph",
          "text": "That last component is what makes the semantic layer relevant to AI specifically: an AI agent is only as accurate as the layer it queries. Expose it to raw tables and it has to guess at business logic; expose it to a governed semantic layer and it inherits the same trusted definitions a human analyst already relies on."
        }
      ]
    },
    {
      "heading": "Why Do AI Agents Need a Semantic Layer?",
      "blocks": [
        {
          "type": "paragraph",